{
    "caseId":  "EXP-001",
    "gitDiff":  "diff --git a/src/main/java/com/example/pocapi/controller/AuthorController.java b/src/main/java/com/example/pocapi/controller/AuthorController.java\nindex 1b4ef10..d2da9c0 100644\n--- a/src/main/java/com/example/pocapi/controller/AuthorController.java\n+++ b/src/main/java/com/example/pocapi/controller/AuthorController.java\n@@ -7,7 +7,9 @@ import org.springframework.http.HttpStatus;\n import org.springframework.http.ResponseEntity;\n import org.springframework.web.bind.annotation.*;\n \n+import java.util.LinkedHashMap;\n import java.util.List;\n+import java.util.Map;\n \n @RestController\n @RequestMapping(\"/authors\")\n@@ -17,9 +19,12 @@ public class AuthorController {\n     private final AuthorService authorService;\n     \n     @GetMapping\n-    public ResponseEntity\u003cList\u003cAuthorDTO\u003e\u003e getAllAuthors() {\n+    public ResponseEntity\u003cMap\u003cString, Object\u003e\u003e getAllAuthors() {\n         List\u003cAuthorDTO\u003e authors = authorService.getAllAuthors();\n-        return ResponseEntity.ok(authors);\n+        Map\u003cString, Object\u003e response = new LinkedHashMap\u003c\u003e();\n+        response.put(\"authors\", authors);\n+        response.put(\"count\", authors.size());\n+        return ResponseEntity.ok(response);\n     }\n     \n     @GetMapping(\"/{id}\")\n",
    "expectedSnapshot":  "[]",
    "receivedSnapshot":  "{\"authors\":[],\"count\":0}",
    "testOutput":  "[INFO] Scanning for projects...\r\n[INFO] \r\n[INFO] ------------------------\u003c com.example:poc-api \u003e-------------------------\r\n[INFO] Building POC API 0.0.1-SNAPSHOT\r\n[INFO]   from pom.xml\r\n[INFO] --------------------------------[ jar ]---------------------------------\r\n[INFO] \r\n[INFO] --- jacoco:0.8.10:prepare-agent (default) @ poc-api ---\r\n[INFO] argLine set to -javaagent:C:\\\\Users\\\\dfber\\\\.m2\\\\repository\\\\org\\\\jacoco\\\\org.jacoco.agent\\\\0.8.10\\\\org.jacoco.agent-0.8.10-runtime.jar=destfile=E:\\\\Diego\\\\TCC\\\\poc-api\\\\target\\\\jacoco.exec\r\n[INFO] \r\n[INFO] --- resources:3.3.1:resources (default-resources) @ poc-api ---\r\n[INFO] Copying 1 resource from src\\main\\resources to target\\classes\r\n[INFO] Copying 0 resource from src\\main\\resources to target\\classes\r\n[INFO] \r\n[INFO] --- compiler:3.12.0:compile (default-compile) @ poc-api ---\r\n[INFO] Nothing to compile - all classes are up to date.\r\n[INFO] \r\n[INFO] --- resources:3.3.1:testResources (default-testResources) @ poc-api ---\r\n[INFO] Copying 1 resource from src\\test\\resources to target\\test-classes\r\n[INFO] \r\n[INFO] --- compiler:3.12.0:testCompile (default-testCompile) @ poc-api ---\r\n[INFO] Nothing to compile - all classes are up to date.\r\n[INFO] \r\n[INFO] --- surefire:3.1.2:test (default-test) @ poc-api ---\r\n[INFO] Using auto detected provider org.apache.maven.surefire.junitplatform.JUnitPlatformProvider\r\n[INFO] \r\n[INFO] -------------------------------------------------------\r\n[INFO]  T E S T S\r\n[INFO] -------------------------------------------------------\r\n[INFO] Running com.example.pocapi.integration.AuthorApiIntegrationTest\r\n20:27:26.427 [main] INFO org.springframework.test.context.support.AnnotationConfigContextLoaderUtils -- Could not detect default configuration classes for test class [com.example.pocapi.integration.AuthorApiIntegrationTest]: AuthorApiIntegrationTest does not declare any static, non-private, non-final, nested classes annotated with @Configuration.\r\n20:27:26.874 [main] INFO org.springframework.boot.test.context.SpringBootTestContextBootstrapper -- Found @SpringBootConfiguration com.example.pocapi.PocApiApplication for test class com.example.pocapi.integration.AuthorApiIntegrationTest\r\n\r\n  .   ____          _            __ _ _\n /\\\\ / ___\u0027_ __ _ _(_)_ __  __ _ \\ \\ \\ \\\n( ( )\\___ | \u0027_ | \u0027_| | \u0027_ \\/ _` | \\ \\ \\ \\\n \\\\/  ___)| |_)| | | | | || (_| |  ) ) ) )\n  \u0027  |____| .__|_| |_|_| |_\\__, | / / / /\n =========|_|==============|___/=/_/_/_/\n\r\n :: Spring Boot ::                (v3.4.1)\r\n\r\n2026-08-09T20:27:28.224-03:00  INFO 14748 --- [poc-api] [           main] c.e.p.i.AuthorApiIntegrationTest         : Starting AuthorApiIntegrationTest using Java 21.0.11 with PID 14748 (started by dfber in E:\\Diego\\TCC\\poc-api)\r\n2026-08-09T20:27:28.224-03:00  INFO 14748 --- [poc-api] [           main] c.e.p.i.AuthorApiIntegrationTest         : The following 1 profile is active: \"test\"\r\n2026-08-09T20:27:33.711-03:00  WARN 14748 --- [poc-api] [           main] org.hibernate.orm.deprecation            : HHH90000025: H2Dialect does not need to be specified explicitly using \u0027hibernate.dialect\u0027 (remove the property setting and it will be selected by default)\r\n2026-08-09T20:27:37.062-03:00  INFO 14748 --- [poc-api] [           main] c.example.pocapi.service.AuthorService   : Initializing sample data...\r\n2026-08-09T20:27:37.344-03:00  INFO 14748 --- [poc-api] [           main] c.example.pocapi.service.AuthorService   : Sample data initialized successfully\r\n2026-08-09T20:27:37.692-03:00  WARN 14748 --- [poc-api] [           main] JpaBaseConfiguration$JpaWebConfiguration : spring.jpa.open-in-view is enabled by default. Therefore, database queries may be performed during view rendering. Explicitly configure spring.jpa.open-in-view to disable this warning\r\n2026-08-09T20:27:38.805-03:00  INFO 14748 --- [poc-api] [           main] c.e.p.i.AuthorApiIntegrationTest         : Started AuthorApiIntegrationTest in 11.405 seconds (process running for 15.101)\r\nMockito is currently self-attaching to enable the inline-mock-maker. This will no longer work in future releases of the JDK. Please add Mockito as an agent to your build what is described in Mockito\u0027s documentation: https://javadoc.io/doc/org.mockito/mockito-core/latest/org/mockito/Mockito.html#0.3\r\nOpenJDK 64-Bit Server VM warning: Sharing is only supported for boot loader classes because bootstrap classpath has been appended\r\nWARNING: A Java agent has been loaded dynamically (C:\\Users\\dfber\\.m2\\repository\\net\\bytebuddy\\byte-buddy-agent\\1.15.11\\byte-buddy-agent-1.15.11.jar)\r\nWARNING: If a serviceability tool is in use, please run with -XX:+EnableDynamicAgentLoading to hide this warning\r\nWARNING: If a serviceability tool is not in use, please run with -Djdk.instrument.traceUsage for more information\r\nWARNING: Dynamic loading of agents will be disallowed by default in a future release\r\n[9 de ago. de 2026 20:27:40 ~000000ms] To approve run : move /Y \"E:\\Diego\\TCC\\poc-api\\.\\src\\test\\java\\com\\example\\pocapi\\integration\\AuthorApiIntegrationTest.testGetAllAuthors_Snapshot.received.txt\"  \"E:\\Diego\\TCC\\poc-api\\.\\src\\test\\java\\com\\example\\pocapi\\integration\\AuthorApiIntegrationTest.testGetAllAuthors_Snapshot.approved.txt\"\n\r\nMockHttpServletRequest:\r\n      HTTP Method = GET\r\n      Request URI = /authors\r\n       Parameters = {}\r\n          Headers = [Content-Type:\"application/json;charset=UTF-8\"]\r\n             Body = null\r\n    Session Attrs = {}\r\n\r\nHandler:\r\n             Type = com.example.pocapi.controller.AuthorController\r\n           Method = com.example.pocapi.controller.AuthorController#getAllAuthors()\r\n\r\nAsync:\r\n    Async started = false\r\n     Async result = null\r\n\r\nResolved Exception:\r\n             Type = null\r\n\r\nModelAndView:\r\n        View name = null\r\n             View = null\r\n            Model = null\r\n\r\nFlashMap:\r\n       Attributes = null\r\n\r\nMockHttpServletResponse:\r\n           Status = 200\r\n    Error message = null\r\n          Headers = [Content-Type:\"application/json\"]\r\n     Content type = application/json\r\n             Body = {\"authors\":[],\"count\":0}\r\n    Forwarded URL = null\r\n   Redirected URL = null\r\n          Cookies = []\r\n[ERROR] Tests run: 1, Failures: 1, Errors: 0, Skipped: 0, Time elapsed: 14.33 s \u003c\u003c\u003c FAILURE! -- in com.example.pocapi.integration.AuthorApiIntegrationTest\r\n[ERROR] com.example.pocapi.integration.AuthorApiIntegrationTest.testGetAllAuthors_Snapshot -- Time elapsed: 1.190 s \u003c\u003c\u003c FAILURE!\r\norg.opentest4j.AssertionFailedError: \nexpected: \u003c[]\n\u003e but was: \u003c{\"authors\":[],\"count\":0}\n\u003e\r\n\tat org.junit.jupiter.api.AssertionFailureBuilder.build(AssertionFailureBuilder.java:151)\r\n\tat org.junit.jupiter.api.AssertionFailureBuilder.buildAndThrow(AssertionFailureBuilder.java:132)\r\n\tat org.junit.jupiter.api.AssertEquals.failNotEqual(AssertEquals.java:197)\r\n\tat org.junit.jupiter.api.AssertEquals.assertEquals(AssertEquals.java:182)\r\n\tat org.junit.jupiter.api.AssertEquals.assertEquals(AssertEquals.java:177)\r\n\tat org.junit.jupiter.api.Assertions.assertEquals(Assertions.java:1145)\r\n\tat java.base/jdk.internal.reflect.DirectMethodHandleAccessor.invoke(DirectMethodHandleAccessor.java:103)\r\n\tat java.base/java.lang.reflect.Method.invoke(Method.java:580)\r\n\tat org.approvaltests.reporters.AbstractJUnitReporter.assertEquals(AbstractJUnitReporter.java:25)\r\n\tat org.approvaltests.reporters.AbstractJUnitReporter.report(AbstractJUnitReporter.java:45)\r\n\tat org.approvaltests.reporters.FirstWorkingReporter.report(FirstWorkingReporter.java:21)\r\n\tat org.approvaltests.reporters.FirstWorkingReporter.report(FirstWorkingReporter.java:21)\r\n\tat org.approvaltests.reporters.FirstWorkingReporter.report(FirstWorkingReporter.java:21)\r\n\tat org.approvaltests.approvers.FileApprover.reportFailure(FileApprover.java:49)\r\n\tat org.approvaltests.Approvals.verify(Approvals.java:220)\r\n\tat org.approvaltests.Approvals.verify(Approvals.java:183)\r\n\tat org.approvaltests.Approvals.verify(Approvals.java:191)\r\n\tat org.approvaltests.Approvals.verify(Approvals.java:50)\r\n\tat org.approvaltests.Approvals.verify(Approvals.java:46)\r\n\tat com.example.pocapi.integration.AuthorApiIntegrationTest.testGetAllAuthors_Snapsh